rank,title,filename,category,headline,intro,readability,natural_us_english,ai_pattern_risk,florida_relevance,decision_support,internal_links,cta_quality,overall_polish,score,status,strengths,weaknesses,ai_notes,florida_notes,internal_link_opportunities,cta_recommendation,visual_opportunity,image_prompt,final_action
25,"Scale Insects on Palm Trees in Florida: Sticky Leaves, Sooty Mold, and Decline",scale-insects-on-palm-trees-in-florida-sticky-leaves-sooty-mold-and-decline.md,Palm Tree Care,9,8,7,8,5,10,9,2,6,5,69,Major rewrite,"Strong scale-versus-mealybug-versus-whitefly distinction; good honeydew and sooty-mold explanation; useful trimming, pesticide, palm-stress, removal, and stump boundaries.",Public Internal Links to Add section; raw source URLs; long and repetitive; pushes a pest query toward removal too often; no direct service-page links; treatment guidance needs a tighter licensed-pest and label boundary.,"Formulaic Short Answer followed by symptom lists, less-urgent/more-serious sections, trimming, spraying, removal, stump, photos, mistakes, CTA, sources, and FAQ.","Strong palm, pool-cage, humidity, pruning, and storm context. Palm species, scale species, life stage, pesticide label, beneficial insects, and licensed pest-control requirements must remain distinct.","/services/tree-trimming/, /services/tree-removal/, scale-versus-white-spots, yellow palm leaves, palm weevils, palm removal decision.","Make identification and plant-health treatment primary; use tree service only for unsafe access, dead fronds, structural decline, removal, or stump work.",Palm scale symptom-and-action map.,"A Florida palm close-up showing armored scale, soft scale with honeydew, mealybugs, whiteflies, sooty mold, healthy spear, declining crown, and separate identify-treat-trim-remove paths.",Major rewrite
26,Black Spot on Palm Fronds: What It May Mean,black-spot-on-palm-fronds-what-it-may-mean.md,Tree Health & Disease,8,7,8,8,6,9,7,1,1,3,58,Major rewrite,Readable older-frond-versus-crown framing; strong emphasis on spear and new growth; discourages panic and over-pruning.,"No H1, sources, internal links, CTA, updated date, photo guidance, or direct action matrix; leaf-spot, nutrient, water, insect, sooty-mold, and lethal-disease distinctions are too vague; several claims need UF/IFAS support.","Natural prose but repetitive 'common mistake', 'important point', and 'final takeaway' structure; relies on broad reassurance rather than diagnostic separation.","Palm symptoms vary by species and frond age. The revision should distinguish surface coating, discrete lesions, nutrient pattern, normal senescence, spear/crown decline, trunk or basal symptoms, and rapid progression.","scale insects, white spots, yellow palm leaves, palm weevils, Ganoderma, lethal bronzing, /services/tree-trimming/, /services/tree-removal/.","Lead with photo-based triage and plant-health diagnosis; route only dead fronds, unsafe crown work, or structurally failing palms to tree services.",Palm black-mark comparison card.,"A Florida palm diagnostic comparison showing black leaf-spot lesions, sooty mold coating, nutrient discoloration, normal aging lower fronds, healthy spear, bud decline, and trunk or basal warning signs.",Major rewrite
27,"White Stuff on Mulch Around Florida Trees: Mold, Fungus, or a Problem?",white-stuff-on-mulch-around-florida-trees-mold-fungus-or-a-problem.md,Landscaping & Planting,9,8,8,8,6,10,9,1,5,5,69,Major rewrite,"Useful decomposition-versus-tree-tissue distinction; strong mulch-depth, root-flare, moisture, drainage, mushroom-location, and do-not-spray guidance.","No H1, sources, contextual links, or updated date; generic dispatch CTA; mixes harmless decomposers, slime molds, artillery fungus, root-zone decay, and structural risk without a concise visual triage; some root-flare statements are too categorical.","Short Answer followed by common causes, harmless/serious, root flare, homeowner steps, mistakes, professional help, better questions, and final takeaway.","Warm humid conditions are relevant, but organism identification, mulch type, irrigation, drainage, and whether growth arises from mulch, roots, or trunk must control the next step.","mulch breakdown, mushy tree beds, root-collar excavation, mushrooms at tree base, Ganoderma, /services/tree-removal/ only for structural decline.","Keep this low-anxiety landscape-maintenance guidance; tree-service CTA should appear only when trunk, root flare, lean, cracking, root movement, or major deadwood is present.",Mulch fungus location triage.,"A Florida mulch bed comparison showing harmless white mycelium in wood chips, slime mold on the surface, mushrooms in mulch, fungal fruiting from trunk or root flare, mulch volcano, visible root flare, and wet drainage conditions.",Major rewrite
28,Tree Transplant Shock in Florida: What Recovery Looks Like,tree-transplant-shock-in-florida-what-recovery-looks-like.md,Landscaping & Planting,9,8,8,8,6,10,8,1,5,5,68,Major rewrite,"Good normal-versus-serious symptom framing; covers root ball, watering, drainage, mulch, planting depth, wind, fertilizer, pruning, and trend-over-time monitoring.","No H1, sources, internal links, updated date, or direct service route; recovery timelines are too broad; no tree-size or root-ball establishment framework; advice does not clearly separate nursery warranty, irrigation correction, planting contractor, arborist, and tree-removal roles.","Short Answer plus cause catalogue, normal signs, Florida stressors, watering, mulch, fertilizer, pruning, serious signs, timeline, questions, CTA, and takeaway.","Establishment varies with trunk caliper, species, nursery stock, root defects, season, soil, irrigation, and planting quality. A fixed weeks-or-months promise should be avoided.","planting and establishment, root flare, tree rocking after planting, post-stump replanting, 811, right-tree/right-place, /services/tree-removal/ only for failed unsafe trees.","Use a check-correct-monitor-escalate flow; direct installation defects and warranties to the installer, plant-health issues to qualified diagnosis, and only unsafe failed trees to removal.",Transplant recovery timeline and warning matrix.,"A newly planted Florida tree timeline showing normal temporary leaf drop, root-ball moisture check, visible root flare, mulch ring, stable versus rocking root ball, new growth, worsening dieback, trunk crack, and standing water.",Major rewrite
29,Planting Near Your House: Avoiding Root Damage to Foundations,planting-near-your-house-avoiding-root-damage-to-foundations.md,Landscaping & Planting,9,8,8,8,6,9,8,1,1,4,62,Major rewrite,"Strong mature-size and site-fit message; correctly rejects the idea that roots deliberately attack foundations; useful canopy, hardscape, roof-clearance, and pruning-burden considerations.","No H1, sources, internal links, CTA, updated date, utilities, septic, drainage, foundation-type, soil, scaled plan, or region-specific plant guidance; opening is alarmist; implies near-house roots and foundation problems more directly than evidence supports.","Repeated 'common mistake', 'this is the most important rule', 'better questions', rule-of-thumb, and final-takeaway patterns.","Foundation and hardscape movement can involve construction, soil, water, leaks, drainage, erosion, paving design, and roots. The article should avoid diagnosing structural damage or prescribing a universal distance.","small trees near house, hardscape planting, foundation myth article, utilities and 811, septic, right-tree/right-place hub, existing-root conflict guide.","Primary CTA should be measure the site, identify utilities, verify mature dimensions, and use Extension/nursery/design guidance; tree service only for an existing conflict.",Near-house mature-zone planning diagram.,"A scaled Florida house plan showing foundation, roof, gutters, driveway, walkway, pool cage, septic, overhead and underground utilities, mature canopy zones, rootable soil, drainage, and small-medium-large planting options.",Major rewrite
30,How to Choose the Right Tree for the Right Place in Florida,how-to-choose-the-right-tree-for-the-right-place-in-florida.md,Landscaping & Planting,9,8,8,8,6,10,9,1,4,5,68,Major rewrite,"Excellent hub concept; strong place-first sequence; covers mature size, sun, drainage, hardscape, utilities, storm exposure, maintenance tolerance, and future yard changes.","No H1, sources, internal links, updated date, regional hardiness, salt, invasive status, septic, private utilities, establishment, or selection matrix; repetitive slogans and generic dispatch CTA; no route to the many focused planting guides.","Highly readable but repeats 'right tree/right place', 'common mistake', 'better questions', and 'final takeaway' without enough tools, sources, or concrete decision outputs.","This should be the master planting hub: Florida region, cold hardiness, salt, soil, drainage, mature dimensions, utilities, targets, litter, wind, establishment, regulations, and future site use.","coastal trees, wind-resistant trees, poolside trees, shade trees, fast-growing shade, small near-house trees, hardscape, post-stump planting, 811.","Use a downloadable-style site inventory and selection matrix; route to Extension/nursery/design guidance first, with separate exits for removal or stump preparation.",Right-tree/right-place master worksheet.,"A Florida property planning worksheet showing region, sun, drainage, salt, mature height and spread, rootable soil, house, pool, pavers, septic, overhead and underground utilities, wind exposure, litter tolerance, and future projects.",Major rewrite
