rank,title,filename,category,headline,intro,readability,natural_us_english,ai_pattern_risk,florida_relevance,decision_support,internal_links,cta_quality,overall_polish,score,status,strengths,weaknesses,ai_notes,florida_notes,internal_link_opportunities,cta_recommendation,visual_opportunity,image_prompt,final_action
9,Can Vines or Ivy Damage a Florida Tree? What Homeowners Should Check First,can-vines-or-ivy-damage-a-florida-tree-what-homeowners-should-check-first.md,Tree Care & Cleanup,9,8,8,8,5,9,7,1,3,3,61,Major rewrite,"Good homeowner intent; distinguishes light vines from woody canopy growth; warns against yanking attached vines; considers concealed decay, canopy weight, structures, power lines, herbicide misuse, and gradual removal.","No H1, decision table, authoritative sources, contextual internal links, direct service routes, current update date, vine-identification workflow, invasive-status check, poison-ivy caution, propagule containment, or qualified pesticide boundary.",Predictable Short Answer → effects → checks → warning signs → herbicide → professional help → takeaway sequence.,"Separate native or low-impact vines, invasive canopy-smothering vines such as air potato, self-clinging ornamentals, poison ivy, and woody vines. Identification must precede control.","Florida tree identification, invasive plant pages, trunk cracks, conks, power-line safety, DIY trimming, trimming/removal services.","Use three routes: identify/manage low vines, qualified invasive-plant control, and tree assessment/pruning when vines conceal defects or reach the canopy. Utility first near lines.",Vine-on-tree identification and action matrix.,"Florida tree vine decision matrix comparing light vine, woody vine, air potato, poison ivy, canopy growth, hidden decay, cut-at-base sequence, herbicide label review, utility first, and arborist inspection.",Major rewrite
10,Can You Cut Down a Tree on Your Own Property in Florida? What Homeowners Should Check First,can-you-cut-down-a-tree-on-your-own-property-in-florida-what-homeowners-should-check-first.md,Permits & Regulations,9,8,8,8,5,10,7,1,4,3,63,Major rewrite,"Strong legal intent; broadens the issue beyond ownership to property line, HOA, easement, right-of-way, protected trees, wetlands, mangroves, documentation, utilities, access, and cleanup.","No H1, decision table, official linked sources, contextual links, direct service routes, current update date, address-first jurisdiction workflow, exact statutory definitions, documentation-versus-estimate distinction, or explicit legal boundary.","Long sequence of legal layers followed by risk signs, documentation, DIY, better questions, and takeaway; several points repeat without a single decision path.",Current section 163.045 narrowly defines covered residential property and specifies an onsite assessment and signed documentation for the unacceptable-risk pathway; the rewrite must not imply every owned tree is exempt.,"Florida permit guide, statute explainer, hazardous-tree documentation, unauthorized-removal fines, HOA, boundary trees, wetlands/mangroves, removal service.","Verify parcel, jurisdiction, tree status, documentation, and written authority before requesting an authorized removal scope.",Florida private-property tree authority flowchart.,"Florida tree-removal authority flowchart showing trunk ownership, survey, city/county, residential-property definition, risk documentation, HOA, right-of-way, mangroves, wetlands, utilities, written confirmation, and authorized removal.",Major rewrite
11,Can You Prune Tree Limbs in Summer in Florida?,can-you-prune-tree-limbs-in-summer-in-florida.md,Tree Care & Cleanup,9,8,8,8,5,10,8,1,4,4,65,Major rewrite,"Useful seasonal intent; correctly says objective and severity matter more than month; covers deadwood, clearance, topping, lion-tailing, palms, stressed trees, wet access, rigging, and utilities.","No H1, table, authoritative sources, contextual links, direct service routes, current date, species/objective matrix, live-crown dose, fruit-tree exceptions, active-nest screen, weather stop conditions, named-storm timing, or emergency-work distinction.",Intro → Short Answer → reasonable work → avoid list → storm myth → palms → stress → oaks → wait → questions → takeaway repeats the same core point.,"Classify dead/broken hazards, young-tree structure, clearance, mature live-limb reduction, palms, fruit trees, stressed trees, active wildlife, wet sites, and approaching tropical weather.","what month to avoid cutting, bad pruning, overpruning, palm pruning, nesting season, hurricane risk, DIY trimming, trimming service.","Separate planned trimming from urgent storm hazards and require a written pruning objective, cut type, approximate live-crown impact, access/weather limits, and utility/wildlife check.",Florida summer pruning go/wait/stop matrix.,"Florida summer pruning matrix with go, wait, and stop lanes for dead branch, clearance, young-tree structure, major live limb, stressed tree, palm, nest, wet yard, lightning, power line, tropical storm, and professional trimming.",Major rewrite
12,Can You Remove Surface Tree Roots Without Hurting the Tree?,can-you-remove-surface-tree-roots-without-hurting-the-tree.md,Arborist Services,9,9,8,8,6,10,8,1,4,5,68,Major rewrite,"Strongest tree-risk article in the package; already has an H1 and distinguishes feeder roots, structural roots, yard conflicts, movement signs, hardscape redesign, utilities, mulch, groundcover, fill, and removal-versus-cutting.","No decision table, authoritative source section, contextual links, direct service routes, current date, root-exposure workflow, cumulative root-loss concept, species/palm distinctions, air-spade role, site-design professional, or formal utility-locate sequence. The one-inch statement reads too universally.",Well organized but still follows Short Answer → causes → risks → root types → warning signs → hardscape → alternatives → questions → takeaway.,"Reject a universal safe diameter or distance; evaluate root size, distance, tree size/species, lean, targets, prior loss, soil, hardscape objective, and redesign alternatives together.","how close to cut roots, air-spade pruning, root damage recovery, retaining-wall roots, driveway decisions, 811, removal versus pruning, removal service.","Route first to tree and site assessment, then hardscape redesign, controlled root work, or removal. Stump grinding is not the service for roots of a living tree.",Surface-root decision and measurement worksheet.,"Florida surface-root worksheet showing trunk, flare, distance, root diameter, previous cuts, lean, soil cracks, driveway, air-spade exposure, redesign, controlled pruning, removal, and Sunshine 811.",Major rewrite
13,Can You Replant in the Same Spot After Stump Grinding?,can-you-replant-in-the-same-spot-after-stump-grinding.md,Landscaping & Planting,9,8,8,8,6,9,8,5,4,5,70,Major rewrite,"Strong practical planting intent; distinguishes turf, shrubs, ornamentals, and new trees; covers chips, remaining roots, settling, drainage, planting depth, offset planting, old stump size, soil preparation, and future use. Existing contextual links are useful.","No H1, decision table, authoritative source section, direct service routes, current date, cause-of-removal screen, right-tree/right-place selection, planting standards, utility locate, irrigation establishment plan, end-use specification, or role distinction between stump provider and planting professional.",Repetitive Short Answer → plant-type sections → waiting → chips → Florida factors → mistakes → questions → FAQ → takeaway; several answers restate that preparation matters more than waiting.,"Classify lawn, bed, shrub, palm, small tree, and large shade tree outcomes. Grinding depth and chip removal must follow the next use; same-spot planting is a site-design decision, not a calendar rule.","existing hole/depth/chip pages plus right tree/right place, planting depth, transplant shock, 811, roots after removal, stump grinding service.",Ask for an end-use-specific stump scope and a separate planting plan; route stump work and planting guidance distinctly.,Post-grinding replanting matrix by intended use.,"Florida stump-site replanting matrix comparing sod, groundcover, shrub, palm, small tree, large tree, chip removal, clean soil, settling, drainage, offset, root flare, irrigation, and utility locate.",Major rewrite
14,Common Mistakes Homeowners Make When Trying to Remove a Stump,common-mistakes-homeowners-make-when-trying-to-remove-a-stump.md,Tree Care & Cleanup,9,8,7,8,4,9,8,1,4,3,61,Major rewrite,"Very comprehensive stump checklist; covers utilities, vehicle pulling, burning, chemicals, roots, species regrowth, chips, cleanup, future use, access, grinding, irrigation, septic, pavers, pools, and quote questions.","No H1, decision table, authoritative sources, contextual links, direct service routes, current date, 811 workflow, private-locate distinction, burn authorization, pesticide boundary, machine safety, metal/rock inspection, bystander exclusion, or finish matrix. Twelve mistakes plus FAQ create excessive repetition.","Highly formulaic numbered list with repeated mini-conclusions, followed by DIY, grinding, questions, takeaway, and FAQs that duplicate earlier content.","Rebuild as a stop-work matrix: no vehicle pulling, improvised burning or chemicals; locate public/private facilities; define end use; measure access; inspect metal/stone; isolate the machine zone; specify depth/chips/backfill.","811 guide, grinder gate access, grinding depth, stump killers, roots after removal, replanting, chip cleanup, stump grinding service.","Use an intake based on size, access, utilities, private systems, species, end use, depth, roots, chips, backfill, and restoration.",DIY stump method stop-work chart.,"Florida DIY stump-removal stop-work chart showing truck pulling, burning, random chemicals, digging near utilities, septic, irrigation, grinder access, hidden metal, exclusion zone, grinding depth, chips, backfill, and replanting.",Major rewrite
15,"Do Stump Killers Really Work, or Is Grinding Better?",do-stump-killers-really-work-or-is-grinding-better.md,Tree Care & Cleanup,9,8,8,8,5,9,8,1,4,4,64,Major rewrite,"Clear chemical-control-versus-physical-removal distinction; useful comparison table; considers regrowth, active yard use, access, utilities, sensitive plants, water, pets, children, replanting, chips, and grinding scope.","No H1, authoritative sources, contextual links, direct service routes, current date, product-category distinctions, label-is-law boundary, cut-stump timing, licensed-application scenarios, species identification, water restrictions, integrated control, or explicit rejection of household chemicals and salt.","The chemical-versus-grinding distinction is repeated in most sections, then repeated again in the table, choice list, questions, takeaway, and FAQ.",Separate decay accelerants from registered herbicides and homeowner label use from work requiring a licensed applicator. Species and desired outcome control the decision.,"DIY stump mistakes, invasive species pages, roots after cutting, grinding depth/access, replanting, 811, stump grinding service.","Identify species and objective, read the exact registered label, protect desirable plants and water, and choose grinding when physical site restoration is the goal.","Chemical treatment, natural decay, and grinding comparison.","Florida stump matrix comparing registered cut-stump herbicide, decay accelerator, natural decay, grinding, sprouting species, active yard, water/garden sensitivity, licensed applicator, utility locate, chips, roots, and replanting.",Major rewrite
16,How Long Do Roots Live After a Tree Is Cut Down?,how-long-do-roots-live-after-a-tree-is-cut-down.md,Tree Care & Cleanup,9,8,7,8,5,9,7,1,4,3,61,Major rewrite,"Useful PAA intent; separates root persistence from continued growth and discusses species resprouting, root size, grinding limits, settling, hardscape voids, replanting, mushrooms, utilities, and follow-up.","No H1, decision table, authoritative sources, contextual links, direct service routes, current date, distinction among living roots/dead woody roots/root channels, species-specific control, utility or sewer exceptions, hardscape-contractor boundary, local-settlement caution, or reliable timeline evidence. The simple timeline reads too predictively.","Many short sections repeat that roots remain and decay; timeline, follow-up, what-not-to-do, grinding benefits, takeaway, and FAQ restate earlier material.","Answer four separate questions: can roots still sprout, can they keep enlarging, how long woody roots can remain, and what yard changes can occur as they decay. Avoid a universal decay calendar.","stump killers, stump grinding, same-spot replanting, settling, pavers, invasive species, 811, stump grinding service.","Route regrowth to species-specific control, visible stump to grinding, hardscape settlement to the appropriate site contractor, and utility/sewer concerns to the responsible specialist.",Root-after-removal process diagram.,"Florida post-removal root diagram showing living stump sprouts, dead woody roots, decay, soil voids, settling, pavers, drainage, mushrooms, grinding, replanting offset, invasive follow-up, and utility/sewer specialist.",Major rewrite
