rank,title,filename,category,headline,intro,readability,natural_us_english,ai_pattern_risk,florida_relevance,decision_support,internal_links,cta_quality,overall_polish,score,status,strengths,weaknesses,ai_notes,florida_notes,internal_link_opportunities,cta_recommendation,visual_opportunity,image_prompt,final_action
1,Florida Tree Removal Cost Guide for Homeowners,florida-tree-removal-cost-guide.md,Tree Removal,8,9,9,8,7,8,8,3,3,6,69,Major rewrite,"Warm homeowner opening; clearly explains access, targets, cleanup, and storm-season complexity.",A cost guide provides no usable price framework; no H1; no sources; repeats ideas already covered in adjacent cost pages.,Repeated 'the real drivers / better question / final takeaway' construction; predictable list cadence.,Florida context is relevant but generic; needs current sourced price methodology and regional caveats.,"/services/tree-removal/, large-tree cost, quote comparison, written estimate, stump grinding.",Add service-page CTA with phone; distinguish planned estimate from active emergency.,Cost-driver decision graphic.,"A realistic Florida residential tree removal estimate scene showing a mature tree near a roof, pool cage, narrow gate, crew measuring access, clean premium editorial infographic labels for size, access, risk, cleanup, and stump scope.",Major rewrite
2,How Much Does It Cost to Remove a Large Tree in Florida?,how-much-does-it-cost-to-remove-a-large-tree-in-florida.md,Tree Removal,9,8,8,7,5,8,8,2,7,4,66,Major rewrite,"Addresses high commercial intent; explains target exposure, rigging, backyard access, and brittle trees.",Visible citation artifacts in published Markdown; price paragraph is unsupported in-page and easy to date; no contextual internal links.,"Short-answer template, repeated rhetorical questions, many parallel lists, formulaic final takeaway.",Needs authoritative and date-stamped pricing method; must separate consumer ranges from actual local quote variables.,"/services/tree-removal/, crane setup, roof removal, tight backyard, estimate guide.",Keep phone CTA but add tree-removal service link and clear no-price-guarantee language.,Large-tree quote anatomy.,"A large mature Florida oak over a house with a tree crew planning sectional removal, crane and rigging options visible, premium homeowner cost-guide layout with callouts for height, canopy spread, roof exposure, access, hauling, and stump grinding.",Major rewrite
3,Oak Tree Removal Cost in Florida: What to Expect,oak-tree-removal-cost-in-florida-what-to-expect.md,Tree Removal,9,8,9,8,7,9,7,2,1,7,67,Major rewrite,"Good explanation of live-oak canopy spread, wood volume, property targets, and controlled dismantling.",No cost ranges or pricing model despite cost intent; no CTA; no sources; limited distinction from general large-tree cost page.,Repeated 'not just height' message and list-heavy structure; generic final takeaway.,Strong live-oak relevance but needs permit/protected-tree caveat and clearer species-versus-site distinction.,"/services/tree-removal/, large oak plan, oak risk, permit guide, stump grinding.",Add removal-service CTA and invite photo/access details for an estimate.,Live-oak canopy and removal complexity diagram.,"A mature Florida live oak spreading over a driveway and roof, arborist crew assessing branch weight and rigging paths, realistic premium editorial illustration with labeled cost factors: canopy spread, trunk size, targets, access, debris volume.",Major rewrite
4,Dead Tree Removal Cost in Florida: What Changes the Price?,dead-tree-removal-cost-in-florida-what-changes-the-price.md,Tree Removal,9,8,8,7,6,8,8,2,7,6,69,Major rewrite,"Correctly explains why dead trees can be more technical because of brittleness, climbing limits, and targets.",Uses vague 2026 ranges without sources; repetitive; no integrated links; urgency language can feel promotional.,"Short-answer formula, repeated 'not automatically cheaper' motif, predictable list-and-summary pattern.",Needs stronger dead-pine/dead-oak distinctions and careful emergency threshold language.,"/services/tree-removal/, dead tree risk, bark beetles, emergency service, quote comparison.","Retain phone CTA, add service link, and separate active failure from normal scheduled removal.",Dead-tree condition versus cost matrix.,"A dead Florida pine and a dead oak shown in two residential settings, one open yard and one over a roof, professional tree crew assessing brittleness and access, clean comparison infographic for size, condition, targets, equipment, hauling.",Major rewrite
5,What Happens During a Tree Removal Estimate in Florida?,what-happens-during-a-tree-removal-estimate-in-florida.md,Tree Removal,9,9,9,8,7,8,8,2,1,7,68,Major rewrite,"Explains the onsite process well and helps homeowners prepare for access, cleanup, risk, and scope questions.","No CTA, sources, service link, or written-estimate handoff; overlaps with quote and estimate articles; no H1.",Recurrent 'more than the tree / bigger question' wording and standard final-takeaway ending.,"Useful Florida examples, but permit, power-line, insurance, and credential boundaries are absent.","/services/tree-removal/, written estimate, quote comparison, permits, what to photograph.",End with a clear estimate-request CTA and a checklist of information to provide.,Onsite estimate walkthrough.,"A Florida homeowner meeting a tree estimator beside a mature tree, estimator checking trunk base, canopy, roof clearance, gate width, pool cage, and debris route, realistic step-by-step editorial graphic.",Major rewrite
6,How to Compare Tree Removal Quotes Without Looking Only at Price,how-to-compare-tree-removal-quotes-without-looking-only-at-price.md,Hiring a Tree Service,9,8,6,7,5,8,9,3,7,4,66,Major rewrite,"Comprehensive scope comparison; excellent table; addresses insurance, worker coverage, cleanup, stump work, permits, lines, and payment.",Public 'Internal Links to Add' editor note remains; one recommended link uses a retired slug; excessive length and major overlap with Sprint 1 quote articles.,Very repetitive 'Compare...' heading pattern; exhaustive checklist feel; mechanical cadence.,Florida-specific verification is useful but licensing and worker language needs careful sourcing and concision.,"Integrate links naturally to written estimate, cleanup, stump quote, hiring red flags, /services/tree-removal/.",Keep CTA but position the article as a one-page comparison worksheet rather than another general hiring guide.,Printable three-quote comparison card.,"A clean premium Florida homeowner quote comparison worksheet beside three tree-service estimates, with check marks for insurance, removal method, hauling, stump grinding, permits, property protection, and final site condition.",Major rewrite
7,Can a Tree Service Remove a Tree in a Tight Backyard?,can-a-tree-service-remove-a-tree-in-a-tight-backyard.md,Tree Removal Decision Guides,9,9,8,8,7,10,9,3,8,8,79,Major rewrite,"Strong homeowner utility; excellent gate, pool cage, paver, hand-carrying, grinder-access, wet-soil, and underground-system coverage.",Overlong and list-dense; minimal contextual internal linking; FAQ repeats body; service link is not explicit.,Short-answer and exhaustive-list pattern; repeated ask/check constructions.,Very strong Florida context; needs clearer 811/private-line distinction and electrical first-response language.,"/services/tree-removal/, /services/stump-grinding/, gate-access stump article, crane setup, yard protection.",Keep phone CTA; add both removal and stump-grinding service paths and a concise photo checklist.,Tight-backyard access plan.,"A realistic Florida backyard with narrow side gate, pool cage, pavers, fence, mature tree, climber using rigging, crew hand-carrying logs, and a compact stump grinder access diagram, premium homeowner guide style.",Major rewrite
8,"When Tree Removal Needs Mats, Cranes, or Special Yard Protection",when-tree-removal-needs-mats-cranes-or-special-yard-protection.md,Tree Care & Cleanup,9,8,9,8,7,9,8,7,7,6,78,Major rewrite,"Clear explanation of mats, rigging, crane use, access, wet soil, and homeowner disclosure; includes contextual links.",Saying mats may be used over septic areas needs correction—heavy traffic over septic components should generally be avoided; crane/power-line wording needs stronger utility/safety limits; no sources.,"Standard short-answer, list, homeowner mistakes, professional-help, final-takeaway template.",Good wet-soil and pool/paver relevance; needs Sunshine 811/private utilities and septic-system caution.,"Add /services/tree-removal/, crane setup, roof removal, rut prevention, pre-work photos.",Retain phone CTA and request access-route photos; add safety disclaimer for lines and septic components.,Yard-protection method selector.,"A Florida tree removal site showing ground protection mats, crane lifting a trunk section, rigging over a pool cage, protected paver driveway, marked irrigation and septic no-drive zone, realistic premium safety infographic.",Major rewrite
