rank,title,filename,category,headline,intro,readability,natural_us_english,ai_pattern_risk,florida_relevance,decision_support,internal_links,cta_quality,overall_polish,score,status,strengths,weaknesses,ai_notes,florida_notes,internal_link_opportunities,cta_recommendation,visual_opportunity,image_prompt,final_action
17,Tree Surveys and Tree Assessments Before Removal: When Are They Required?,tree-surveys-and-tree-assessments-before-removal-when-are-they-required.md,Florida Laws & Property Risk,9,8,8,8,6,10,7,1,4,4,65,Major rewrite,"Strong distinction between tree survey and tree assessment; recognizes permit, protected-tree, development, HOA, insurer, storm-damage, and residential hazard-documentation contexts; includes useful local examples and homeowner questions.","No H1, authoritative source section, decision table, contextual internal links, direct service routes, current date, clear distinction among survey, inventory, risk assessment, arborist letter, site plan, and permit package, or precise limits around Florida Statute 163.045. The CTA implies ProTreeTrim can decide which formal document is required.","Short Answer followed by definition pairs, statewide/local examples, development use, common situations, mistakes, better questions, professional help, and final takeaway.","The revision must verify current statutory language and local examples, separate residential hazard documentation from development review, and identify who may prepare each document. Local permit staff, surveyors, arborists, landscape architects, engineers, and attorneys have different roles.","hazardous-tree documentation, Florida statute page, unauthorized-removal fines, city preservation rules, permit guide, homebuyer inspection, tree removal service.","Route local permit requirements to the jurisdiction, boundary mapping to a surveyor, tree condition and risk to the appropriate qualified professional, and physical removal only after documentation and authority are resolved.",Survey-versus-assessment document matrix.,"A Florida pre-removal documentation chart comparing tree survey, inventory, arborist assessment, risk report, landscape architect letter, site plan, permit package, protected-tree review, development project, and authorized removal.",Major rewrite
18,Tree Preservation Orders in Florida Cities,tree-preservation-orders-in-florida-cities.md,Florida Laws & Property Risk,8,8,8,8,5,10,6,1,1,3,58,Major rewrite,"Correctly explains that 'tree preservation order' is not one statewide Florida term; emphasizes city/county jurisdiction, protected classes, size/species thresholds, permits, mitigation, development, hazardous-tree distinctions, and HOA overlap.","No H1, authoritative local or statutory sources, decision table, contextual links, CTA, service route, current date, official jurisdiction-lookup workflow, permit-record checklist, development-versus-homeowner distinction, appeal or after-the-fact process, or explicit warning against relying on stale local rules.","Repeated 'why misunderstood,' 'common mistake,' 'another common mistake,' 'why slow down,' practical mindset, and final takeaway. The article restates local variation many times without giving a usable verification path.","The revision should explain how to identify city versus unincorporated county jurisdiction, locate the current ordinance and permit portal, screen protected status, check mitigation and replacement, distinguish hazard documentation, and preserve written determinations.","tree survey/assessment page, unauthorized-removal fines, Florida statute page, permit guide, HOA approval, mangrove rules, removal service.",Primary CTA should be verify the controlling jurisdiction and written permit/exemption status. ProTreeTrim should route physical work only after local and HOA authority are clear.,Local tree-rule verification workflow.,"A Florida city tree-preservation workflow showing property address, city versus county jurisdiction, ordinance, protected-tree screen, permit portal, hazard documentation, mitigation, HOA approval, written determination, and authorized tree work.",Major rewrite
19,Can a City Fine You for Unauthorized Tree Removal in Florida?,can-a-city-fine-you-for-unauthorized-tree-removal-in-florida.md,Florida Laws & Property Risk,9,9,8,8,6,10,6,1,1,1,59,Major rewrite,"Directly answers the fine question; recognizes protected trees, permit status, statutory exemptions, contractor involvement, mitigation, stop-work consequences, local variation, and the need to verify before removal.","No H1, clean source section, decision table, internal links, CTA, service route, current date, enforcement-notice workflow, evidence checklist, hearing/appeal and attorney boundaries, or after-the-fact mitigation path. Public `turn...` citation artifacts are visible throughout. Precise fine figures and an old enforcement case are presented without stable linked authority or date context.","Yes-answer, why misunderstood, local examples, definition, protected-tree section, fines, consequences, statute mistake, contractor mistake, city purpose, checklist, dangerous-tree section, mindset, and final takeaway.","High legal and financial risk. The revision must distinguish permit violation, protected-tree injury, specimen/public tree offenses, contractor versus owner exposure, notice, code hearing, mitigation, emergency documentation, and current local fee schedules without implying one city’s penalty applies elsewhere.","city preservation rules, survey/assessment page, Florida statute page, hazardous-tree documentation, after-the-fact removal permits, HOA approval, removal service.","Primary CTA should be stop work, preserve the permit/exemption record, contact the enforcing jurisdiction, meet deadlines, and obtain Florida legal advice when a notice or substantial penalty exists.",Unauthorized-removal enforcement timeline.,"A Florida unauthorized tree-removal enforcement workflow showing protected-tree screen, permit status, stop-work notice, photographs, contractor records, code case, hearing deadline, mitigation or replacement, attorney review, and future authorized work.",Major rewrite
20,What Month Should You Avoid Cutting Trees in Florida?,what-month-should-you-avoid-cutting-trees-in-florida.md,Tree Risk & Property Maintenance,9,9,8,8,6,10,8,1,5,4,68,Major rewrite,"Strong search intent; clearly rejects one forbidden month; provides a useful seasonal table, separates pruning from removal, warns against last-minute hurricane cuts and palm overpruning, recognizes wildlife, permits, utilities, access, and emergency exceptions.","No H1, authoritative horticultural or wildlife sources, contextual links, direct service routes, current date, species-specific timing matrix, oak-wilt and disease-pruning nuance, protected-bird and active-nest legal boundaries, weather-stop rules, or clear evidence for singling out June. Several biological and wildlife claims are broad.","Short Answer, why month matters, caution table, 'pick one month' hook, storm pruning, wildlife, emergency, pruning-versus-removal, decision filter, contractor questions, CTA, and FAQ.","The revision should be organized by work type and tree group rather than a universal month. It needs current UF/IFAS pruning guidance, FWC/USFWS active-nest boundaries, hurricane-season planning, palm standards, disease considerations, and emergency overrides.","hurricane-season palm trimming, nesting-season removal, tree trimming versus removal, post-storm inspection, hazardous-tree signs, trimming and emergency service pages.","Offer separate routes for planned structural pruning, palm care, wildlife-sensitive timing, and immediate hazard work. Avoid telling users that June itself is broadly unsafe.",Florida tree-work timing matrix.,"A Florida seasonal tree-care chart comparing structural pruning, deadwood, palm care, active nests, hurricane preparation, named-storm conditions, saturated soil, disease-sensitive species, and emergency removal.",Major rewrite
21,The Dangers of DIY Tree Removal in Florida,the-dangers-of-diy-tree-removal-in-florida.md,Tree Removal,8,8,8,8,5,9,6,1,1,3,57,Major rewrite,"Strong commercial and safety intent; explains lean, storm damage, loaded wood, saturated soil, roof/pool/fence constraints, chainsaw-versus-judgment distinction, hidden cost, low-risk homeowner tasks, and stop signs.","No H1, authoritative safety sources, decision table, contextual links, CTA, service route, current date, power-line and utility-first rule, ladder and elevated-work boundaries, PPE limitations, chainsaw kickback and struck-by/crush risks, emergency contacts, permit/ownership screen, or an objective DIY-versus-professional threshold. Tone sometimes relies on fear and repetition.","Emotional setup, why it looks easy, Florida conditions, biggest mistake, five scenarios, chainsaw confidence, hidden cost, safe tasks, warning signs, one-limb scenario, storm-week scenario, better question, and takeaway.","The revision should define a narrow low-risk homeowner lane and a clear professional-only lane. Any overhead cutting, climbing, loaded storm wood, line proximity, large-diameter cutting, unstable roots, or target exposure should trigger a stop.","emergency safety page, power-line removal, hung-up tree, crane/access article, tree removal quote, emergency and removal services.",Use a factual stop-work matrix rather than fear marketing. Route stable open-ground estimates to removal service and active instability to emergency response.,DIY stop-work matrix.,"A Florida DIY tree-work safety matrix showing ground debris, small hand-pruning, chainsaw use, ladder, overhead limb, leaning tree, split trunk, loaded storm wood, roof target, power line, stop-work icons, and professional service routes.",Major rewrite
22,How to Make a Florida Tree Emergency Safer Before Help Arrives,how-to-make-a-florida-tree-emergency-safer-before-help-arrives.md,Emergency Storm,9,9,8,8,6,10,8,1,1,4,64,Major rewrite,"Strong immediate-safety intent; correctly emphasizes distance, overhead hazards, root movement, hanging wood, blocked access, photographs, barriers, avoiding cuts, changing load, delayed failure, alternate paths, and exposure control.","No H1, authoritative emergency/utility sources, decision table, contextual links, CTA, direct emergency route, current date, 911/fire/gas/utility branching, energized-ground warning, structural-collapse and roof-entry boundaries, floodwater, evacuation decision, insurer notification, or safer barrier guidance. Suggesting chairs or tape can be too weak for a severe hazard.","Emotional setup, what makes emergency dangerous, first rule, numbered actions, definition of making safer, do-not list, DIY explanation, scenarios, speed mistake, storm-passed mistake, access priorities, seriousness checklist, and takeaway.","This should become a concise emergency protocol. It must prioritize 911 for life danger, utility control for lines, evacuation for structural or fire/gas risks, a conservative exclusion zone, safe documentation, insurer notice, and no tree manipulation.","power-line storm page, tree touching power lines, kids/pets yard safety, what to save before cleanup, emergency cleanup versus removal, emergency service.",Add an explicit emergency hierarchy and direct call route. ProTreeTrim should be contacted only after emergency services or the utility when those hazards exist.,First-ten-minutes emergency card.,"A Florida tree-emergency first-ten-minutes card showing 911, utility, gas/fire, evacuation, exclusion zone, alternate exit, safe photos, insurer notice, no cutting, no roof access, and emergency tree-service handoff.",Major rewrite
23,How to Make a Storm-Damaged Yard Safer for Kids and Pets,how-to-make-a-storm-damaged-yard-safer-for-kids-and-pets.md,Emergency Storm,9,9,8,8,6,10,8,1,5,4,68,Major rewrite,"Excellent family-safety intent; strong red/yellow/green zoning concept; covers hanging limbs, changed lean, root movement, sharp debris, damaged fences, debris piles, supervised access, pet and child behavior, and reopening criteria.","No H1, authoritative emergency or veterinary sources, decision table, contextual links, direct service routes, current date, utility/energized-ground screen, floodwater, standing water, snakes/insects, chemicals, heat, septic hazards, structural debris, pet paw and ingestion checks, veterinary/medical escalation, or a written yard-reopening checklist.","Storm setup, biggest mistake, unsafe-yard explanation, what to secure, kid/pet vulnerability, no-access rule, inspection list, separate pet/child sections, color zones, do-not list, reopening, professional help, and takeaway.","The revision should keep the strong zoning framework while adding the Florida post-storm hazards most likely to affect children and animals. It must distinguish tree-service hazards from utility, flood, medical, veterinary, structural, and animal-control issues.","emergency safer-before-help page, power-line page, post-storm inspection, debris cleanup, flooded-soil failure, emergency cleanup records, emergency service.","Use a printable reopening checklist and explicit red-zone closure. Route injuries, ingestion, heat illness, wildlife, electrical, and structural hazards to the appropriate emergency professional.",Red-yellow-green yard reopening map.,"A Florida post-storm yard safety map for children and pets showing red no-entry zone, yellow supervised path, green relief area, hanging limbs, root movement, broken fence, sharp debris, power line, floodwater, pet leash, and reopening checklist.",Major rewrite
24,Large Tree Removal Near Power Lines: Safety First,large-tree-removal-near-power-lines-safety-first.md,Tree Removal,8,8,8,8,5,10,5,1,1,1,55,Major rewrite,"Correctly treats line proximity as a special hazard; explains branch swing, trunk rotation, rigging, storm damage, saturated soil, service-line complacency, visual-distance error, documentation, and avoiding DIY work.","No H1, authoritative utility or OSHA sources, decision table, contextual links, CTA, service route, current date, utility-first contact process, downed-line and energized-ground warning, distribution-versus-service-drop distinction, line-clearance qualification, minimum-approach-distance boundary, de-energization/line-drop workflow, or emergency hierarchy. It says caution but does not tell homeowners whom to call first.","Why different, no-contact misconception, large-tree issue, distance error, storm damage, mistakes, first steps, DIY warning, rain, urgency, questions, slogan explanation, and takeaway.","Highest immediate life-safety risk in the package. The revision must tell users to assume lines are energized, stay away from trees touching lines and downed conductors, contact the utility before any private tree provider, and require appropriately qualified line-clearance work.","tree touching power lines after storm, easements/utilities page, emergency safer-before-help page, DIY dangers, storm-damaged tree, emergency service.","Utility first, 911 for immediate life danger, then private tree work only after the utility identifies the safe scope. ProTreeTrim should not dispatch ordinary tree crews into an energized-line hazard.",Power-line tree emergency hierarchy.,"A Florida power-line tree safety flowchart showing assume energized, stay away, downed-line ground hazard, 911, electric utility, distribution line, service drop, communications cable, qualified line-clearance arborist, de-energization, and private tree-work handoff.",Major rewrite
